{
  "schema": "go-workflow.managed-run.v1",
  "task_id": "reliability-05",
  "project": "go-workflow-stack",
  "control_repo": "/Users/viggomeesters/Dev/go-workflow-stack",
  "owner": "codex-astra-high",
  "run_id": "verify-361eb8a1405e4b769680ce9ef8643e77",
  "workspace": {
    "path": "/Users/viggomeesters/Dev/go-workflow-stack",
    "control_repo": "/Users/viggomeesters/Dev/go-workflow-stack"
  },
  "phase": "complete",
  "attempt": 1,
  "check_index": 0,
  "checks": [
    {
      "verification": {
        "schema": "go-workflow.verification-evidence.v1",
        "task_id": "reliability-05",
        "phase_id": "verify",
        "requirement_ids": [
          "R1",
          "R2",
          "R3"
        ],
        "status": "passed",
        "command": "python3 -m pytest tests/test_release_pairings.py -q",
        "cwd": "/Users/viggomeesters/Dev/go-workflow-stack",
        "revision": "f50567c6cfcabf1c30fa4f848e3d0362d7502024",
        "worktree_digest": "2480fe418ab23cbc3cb7a81dba0b2d9b2c4d6a5a9cabdaff1e01f82a405821f9",
        "exit_code": 0,
        "evidence": [
          ".go/runs/reliability-05/completion/command-c51eb926eaf24d9085996d85dc794541.json"
        ]
      },
      "raw": {
        "path": ".go/runs/reliability-05/completion/command-c51eb926eaf24d9085996d85dc794541.json",
        "sha256": "812ee4bc6c19b7e47d8c08389b741889dd3efc03b0df42791dc794a3576ca555"
      }
    },
    {
      "verification": {
        "schema": "go-workflow.verification-evidence.v1",
        "task_id": "reliability-05",
        "phase_id": "verify",
        "requirement_ids": [
          "R1",
          "R2",
          "R3"
        ],
        "status": "passed",
        "command": "python3 cli/go.py validate .",
        "cwd": "/Users/viggomeesters/Dev/go-workflow-stack",
        "revision": "f50567c6cfcabf1c30fa4f848e3d0362d7502024",
        "worktree_digest": "2480fe418ab23cbc3cb7a81dba0b2d9b2c4d6a5a9cabdaff1e01f82a405821f9",
        "exit_code": 0,
        "evidence": [
          ".go/runs/reliability-05/completion/command-ac35943ec1bc491bb2f916f55a031cc7.json"
        ]
      },
      "raw": {
        "path": ".go/runs/reliability-05/completion/command-ac35943ec1bc491bb2f916f55a031cc7.json",
        "sha256": "917c880a4918ba30746bf5add7546f521e668bbe34c5221867db477d82e028d5"
      }
    },
    {
      "verification": {
        "schema": "go-workflow.verification-evidence.v1",
        "task_id": "reliability-05",
        "phase_id": "verify",
        "requirement_ids": [
          "R1",
          "R2",
          "R3"
        ],
        "status": "passed",
        "command": "git diff --check",
        "cwd": "/Users/viggomeesters/Dev/go-workflow-stack",
        "revision": "f50567c6cfcabf1c30fa4f848e3d0362d7502024",
        "worktree_digest": "2480fe418ab23cbc3cb7a81dba0b2d9b2c4d6a5a9cabdaff1e01f82a405821f9",
        "exit_code": 0,
        "evidence": [
          ".go/runs/reliability-05/completion/command-a95442e4eb164acb8935c8b16dfe9615.json"
        ]
      },
      "raw": {
        "path": ".go/runs/reliability-05/completion/command-a95442e4eb164acb8935c8b16dfe9615.json",
        "sha256": "215d57e73f6f79522a821a1cc49a13d91ca24a0477c517cee071c42a0389dbba"
      }
    }
  ],
  "phase_evidence": [],
  "effects": {},
  "budgets": [],
  "history": [],
  "requirements": [
    {
      "id": "R1",
      "text": "One validated manifest owns the existing historical stack-to-template release mappings, exact commits and current tested pairing; release hydration reads it without changing published historical tags.",
      "source": "intake_acceptance",
      "status": "pending",
      "evidence": []
    },
    {
      "id": "R2",
      "text": "A checker detects contradictory refs, invalid hashes, missing mappings and mismatched current template pins/docs; current version metadata can be rendered deterministically without rewriting historical evidence.",
      "source": "intake_acceptance",
      "status": "pending",
      "evidence": []
    },
    {
      "id": "R3",
      "text": "Ship the scoped change with current verification, critic, integration, immutable release and remote readback.",
      "source": "intake_acceptance",
      "status": "pending",
      "evidence": []
    }
  ],
  "models": {},
  "task_hash": "a3d886daa099d6792adc4497ec611e099c7ea3a746aaef66a031d6daf9f83b2e",
  "code": {},
  "execution_cwd": "/Users/viggomeesters/Dev/go-workflow-stack",
  "controller": {
    "host": "MacBook-Pro-van-Viggo.local",
    "pid": 43011
  },
  "worker_group": null,
  "inflight": null
}
