{
  "schema": "go-workflow.managed-run.v1",
  "task_id": "autonomy-02",
  "project": "go-workflow-stack",
  "control_repo": "/Users/viggomeesters/Dev/go-workflow-stack",
  "owner": "codex-astra-high",
  "run_id": "verify-e03b5a7c9eee46e6a5186a72c30dbb70",
  "workspace": {
    "path": "/Users/viggomeesters/Dev/go-workflow-stack",
    "control_repo": "/Users/viggomeesters/Dev/go-workflow-stack"
  },
  "phase": "complete",
  "attempt": 1,
  "check_index": 0,
  "checks": [
    {
      "verification": {
        "schema": "go-workflow.verification-evidence.v1",
        "task_id": "autonomy-02",
        "phase_id": "verify",
        "requirement_ids": [
          "R1",
          "R2",
          "R3",
          "R4",
          "R5"
        ],
        "status": "passed",
        "command": "uv run --no-project --python 3.12 --with 'pytest>=8,<9' --with 'jsonschema>=4.23' python -m pytest tests/test_autonomy_intake.py tests/test_task_design_readiness.py tests/test_architecture.py -q -p no:cacheprovider",
        "cwd": "/Users/viggomeesters/Dev/go-workflow-stack",
        "revision": "49cfbe29d6a1c922ecd0e49d8e05a90105098dde",
        "worktree_digest": "4a7a2da48541acd3ce81013977a1fa6573b592c6af7df278ab60d896bf6d1c1f",
        "exit_code": 0,
        "evidence": [
          ".go/runs/autonomy-02/completion/command-5da8a2c2e5494f70bb12f1f860f6d8af.json"
        ]
      },
      "raw": {
        "path": ".go/runs/autonomy-02/completion/command-5da8a2c2e5494f70bb12f1f860f6d8af.json",
        "sha256": "1767fef07eb6c93d886fee13eb064b29e66a33335d9becffe1ff37d32c2278fc"
      }
    },
    {
      "verification": {
        "schema": "go-workflow.verification-evidence.v1",
        "task_id": "autonomy-02",
        "phase_id": "verify",
        "requirement_ids": [
          "R1",
          "R2",
          "R3",
          "R4",
          "R5"
        ],
        "status": "failed",
        "command": "make check",
        "cwd": "/Users/viggomeesters/Dev/go-workflow-stack",
        "revision": "49cfbe29d6a1c922ecd0e49d8e05a90105098dde",
        "worktree_digest": "4a7a2da48541acd3ce81013977a1fa6573b592c6af7df278ab60d896bf6d1c1f",
        "exit_code": 2,
        "evidence": [
          ".go/runs/autonomy-02/completion/command-90de947d3aa449318e6b34d79b404624.json"
        ]
      },
      "raw": {
        "path": ".go/runs/autonomy-02/completion/command-90de947d3aa449318e6b34d79b404624.json",
        "sha256": "ce61bcb47816e631d8ee995780fa20cf8e32b717b90193019cba684fca5f4653"
      }
    },
    {
      "verification": {
        "schema": "go-workflow.verification-evidence.v1",
        "task_id": "autonomy-02",
        "phase_id": "verify",
        "requirement_ids": [
          "R1",
          "R2",
          "R3",
          "R4",
          "R5"
        ],
        "status": "passed",
        "command": "python3 cli/go.py validate .",
        "cwd": "/Users/viggomeesters/Dev/go-workflow-stack",
        "revision": "49cfbe29d6a1c922ecd0e49d8e05a90105098dde",
        "worktree_digest": "4a7a2da48541acd3ce81013977a1fa6573b592c6af7df278ab60d896bf6d1c1f",
        "exit_code": 0,
        "evidence": [
          ".go/runs/autonomy-02/completion/command-0296984be4484c96a1c5cfea49d60c0d.json"
        ]
      },
      "raw": {
        "path": ".go/runs/autonomy-02/completion/command-0296984be4484c96a1c5cfea49d60c0d.json",
        "sha256": "a58881f7afcccb489625c2dea295064a92cf95d912e143943904b0ebd3c48f48"
      }
    },
    {
      "verification": {
        "schema": "go-workflow.verification-evidence.v1",
        "task_id": "autonomy-02",
        "phase_id": "verify",
        "requirement_ids": [
          "R1",
          "R2",
          "R3",
          "R4",
          "R5"
        ],
        "status": "passed",
        "command": "git diff --check",
        "cwd": "/Users/viggomeesters/Dev/go-workflow-stack",
        "revision": "49cfbe29d6a1c922ecd0e49d8e05a90105098dde",
        "worktree_digest": "4a7a2da48541acd3ce81013977a1fa6573b592c6af7df278ab60d896bf6d1c1f",
        "exit_code": 0,
        "evidence": [
          ".go/runs/autonomy-02/completion/command-6706d0fab84745e6af0336b9fd4a189e.json"
        ]
      },
      "raw": {
        "path": ".go/runs/autonomy-02/completion/command-6706d0fab84745e6af0336b9fd4a189e.json",
        "sha256": "e98563c78b0459667f40688d9a25e00a9a23306bc63f3889a687c79cb276406a"
      }
    }
  ],
  "phase_evidence": [],
  "effects": {},
  "budgets": [],
  "history": [],
  "requirements": [
    {
      "id": "R1",
      "text": "Preserve every original requested outcome and source; detect matching existing work and superseded decisions. Repeated intake does not duplicate tasks or lose feedback.",
      "source": "intake_acceptance",
      "status": "pending",
      "evidence": []
    },
    {
      "id": "R2",
      "text": "Substantial tasks have observable before/after behavior, relevant states/edges, non-goals, enforceable dependencies, delegated choices and outcome-appropriate proof. Unknown bug root cause cannot become fixed; research completion remains distinct from implementation.",
      "source": "intake_acceptance",
      "status": "pending",
      "evidence": []
    },
    {
      "id": "R3",
      "text": "Use actual bounded model exploration/assessment through existing adapters; deterministic tests prove transport, authority and persistence rather than pretending keywords/schema prove semantic quality. Legacy tiny tasks stay lightweight.",
      "source": "intake_acceptance",
      "status": "pending",
      "evidence": []
    },
    {
      "id": "R4",
      "text": "Planning-only requests stop before execution; advice is not execution authority. Persist questions needing the user while continuing only independent authorized research/work; no automatic vision/decision rewriting.",
      "source": "intake_acceptance",
      "status": "pending",
      "evidence": []
    },
    {
      "id": "R5",
      "text": "Complete this independently shippable stack change with content-bound checks/critic, scoped commit/push, immutable release and remote readback; preserve user dirt and historical evidence. Current request authorizes planning only; no execution or publication starts during intake.",
      "source": "intake_acceptance",
      "status": "pending",
      "evidence": []
    }
  ],
  "models": {},
  "task_hash": "0075b60a0516d27f91405b53ba32edfd59062051325afcc603b654815303c1cd",
  "code": {},
  "execution_cwd": "/Users/viggomeesters/Dev/go-workflow-stack",
  "controller": {
    "host": "mac.home",
    "pid": 64897
  },
  "worker_group": null,
  "inflight": null
}
