{
  "schema": "go-workflow.managed-run.v1",
  "task_id": "abc-05",
  "project": "go-workflow-stack",
  "control_repo": "/Users/viggomeesters/Dev/go-workflow-stack",
  "owner": "codex-astra-high",
  "run_id": "verify-519e3ce141bc4eb59f24669a71223f1b",
  "workspace": {
    "path": "/Users/viggomeesters/Dev/go-workflow-stack",
    "control_repo": "/Users/viggomeesters/Dev/go-workflow-stack"
  },
  "phase": "complete",
  "attempt": 1,
  "check_index": 0,
  "checks": [
    {
      "verification": {
        "schema": "go-workflow.verification-evidence.v1",
        "task_id": "abc-05",
        "phase_id": "verify",
        "requirement_ids": [
          "R1",
          "R2",
          "R3",
          "R4",
          "R5",
          "R6",
          "R7",
          "R8"
        ],
        "status": "passed",
        "command": "python3 -m pytest tests/test_abc_completion.py -q",
        "cwd": "/Users/viggomeesters/Dev/go-workflow-stack",
        "revision": "71328de2ec18f5fc809dbaeea29031d3b1a83bf6",
        "worktree_digest": "f31d704e2060c456cfac31cbe52b6bdb6eccbebd3278a43552caf96e16123b58",
        "exit_code": 0,
        "evidence": [
          ".go/runs/abc-05/completion/command-8da2ccb9b3c34e048e88744211423980.json"
        ]
      },
      "raw": {
        "path": ".go/runs/abc-05/completion/command-8da2ccb9b3c34e048e88744211423980.json",
        "sha256": "3a400c1218beae320815e24440b80f6491816da2cb6cb32e2a931c320c38cab8"
      }
    },
    {
      "verification": {
        "schema": "go-workflow.verification-evidence.v1",
        "task_id": "abc-05",
        "phase_id": "verify",
        "requirement_ids": [
          "R1",
          "R2",
          "R3",
          "R4",
          "R5",
          "R6",
          "R7",
          "R8"
        ],
        "status": "passed",
        "command": "python3 cli/go.py validate .",
        "cwd": "/Users/viggomeesters/Dev/go-workflow-stack",
        "revision": "71328de2ec18f5fc809dbaeea29031d3b1a83bf6",
        "worktree_digest": "f31d704e2060c456cfac31cbe52b6bdb6eccbebd3278a43552caf96e16123b58",
        "exit_code": 0,
        "evidence": [
          ".go/runs/abc-05/completion/command-23d10b8b67bb466d86cf714d43b2fa41.json"
        ]
      },
      "raw": {
        "path": ".go/runs/abc-05/completion/command-23d10b8b67bb466d86cf714d43b2fa41.json",
        "sha256": "40c3a29f382fffc54f45386e895b1eaebf05d398f3ad434f018a219bd3137002"
      }
    },
    {
      "verification": {
        "schema": "go-workflow.verification-evidence.v1",
        "task_id": "abc-05",
        "phase_id": "verify",
        "requirement_ids": [
          "R1",
          "R2",
          "R3",
          "R4",
          "R5",
          "R6",
          "R7",
          "R8"
        ],
        "status": "passed",
        "command": "git diff --check",
        "cwd": "/Users/viggomeesters/Dev/go-workflow-stack",
        "revision": "71328de2ec18f5fc809dbaeea29031d3b1a83bf6",
        "worktree_digest": "f31d704e2060c456cfac31cbe52b6bdb6eccbebd3278a43552caf96e16123b58",
        "exit_code": 0,
        "evidence": [
          ".go/runs/abc-05/completion/command-2534cdc9a581482facb4269b728dfc6a.json"
        ]
      },
      "raw": {
        "path": ".go/runs/abc-05/completion/command-2534cdc9a581482facb4269b728dfc6a.json",
        "sha256": "10f06aa646eece59fc9c1341d1938fd0a37627e0b6376eaf330213ef4c7ad3f0"
      }
    }
  ],
  "phase_evidence": [],
  "effects": {},
  "budgets": [],
  "history": [
    {
      "event": "new_verification_capture",
      "previous_inflight": null
    }
  ],
  "requirements": [
    {
      "id": "R1",
      "text": "Een mislukte of niet-bevestigde push laat releaseplichtig werk pending/active/blocked en nooit done of completed_tasks; taakstatus en runstatus blijven consistent.",
      "source": "abc_planning",
      "status": "verified",
      "evidence": [
        {
          "created_at": "2026-09-13T16:42:48+02:00",
          "agent": "codex-astra-high",
          "summary": ".go/runs/abc-05/completion/verification-8d2d3adf7f1c4e418ca2bb745c7ab4bb.json"
        }
      ]
    },
    {
      "id": "R2",
      "text": "Handmatige finish, automatische finish, approval en taak-/goalrapportage gebruiken dezelfde gate; alleen proza of een model-success kan bewijs niet vervangen.",
      "source": "abc_planning",
      "status": "verified",
      "evidence": [
        {
          "created_at": "2026-09-13T16:42:48+02:00",
          "agent": "codex-astra-high",
          "summary": ".go/runs/abc-05/completion/verification-8d2d3adf7f1c4e418ca2bb745c7ab4bb.json"
        }
      ]
    },
    {
      "id": "R3",
      "text": "Work, review en releasevoortgang zijn onderscheiden. Eén afgeronde taak vereist niet dat de hele backlog leeg is; een campagne claimt geen volledige goal-completion zolang werk resteert.",
      "source": "abc_planning",
      "status": "verified",
      "evidence": [
        {
          "created_at": "2026-09-13T16:42:48+02:00",
          "agent": "codex-astra-high",
          "summary": ".go/runs/abc-05/completion/verification-8d2d3adf7f1c4e418ca2bb745c7ab4bb.json"
        }
      ]
    },
    {
      "id": "R4",
      "text": "Commit, gecontroleerde inhoud en geverifieerde remote branch/SHA zijn gekoppeld; latere integratie of releasevoorbereiding invalideert verouderde relevante checks.",
      "source": "abc_planning",
      "status": "verified",
      "evidence": [
        {
          "created_at": "2026-09-13T16:42:48+02:00",
          "agent": "codex-astra-high",
          "summary": ".go/runs/abc-05/completion/verification-8d2d3adf7f1c4e418ca2bb745c7ab4bb.json"
        }
      ]
    },
    {
      "id": "R5",
      "text": "Een releaseprofiel waarvoor nog geen publisher bestaat wordt eerlijk geblokkeerd; legacy gedrag verandert uitsluitend volgens de gekozen migratiepolicy.",
      "source": "abc_planning",
      "status": "verified",
      "evidence": [
        {
          "created_at": "2026-09-13T16:42:48+02:00",
          "agent": "codex-astra-high",
          "summary": ".go/runs/abc-05/completion/verification-8d2d3adf7f1c4e418ca2bb745c7ab4bb.json"
        }
      ]
    },
    {
      "id": "R6",
      "text": "Lever deze begrensde wijziging als zelfstandig verifieerbare, achterwaarts compatibele release op: relevante checks en critic groen, documentatie/changelog en passende versie bijgewerkt, scoped commit/integratie/push, annotated tag/publicatie en remote readback bewezen. Ontbrekende publicatierechten of bewijs blijven expliciete blockers. Deze intake autoriseert nu uitsluitend planning.",
      "source": "abc_planning",
      "status": "pending",
      "evidence": []
    },
    {
      "id": "R7",
      "text": "Verificatie voert de afgesproken lokale commando’s uit en registreert cwd, argv/commando, exitcode, geteste revisie/werkdiff en bewijsreferentie. Alleen een gevuld veld, test_evidence:none of een oud geslaagd resultaat kan verplichte checks niet vervangen.",
      "source": "legacy_insights_planning",
      "status": "verified",
      "evidence": [
        {
          "created_at": "2026-09-13T16:42:48+02:00",
          "agent": "codex-astra-high",
          "summary": ".go/runs/abc-05/completion/verification-8d2d3adf7f1c4e418ca2bb745c7ab4bb.json"
        }
      ]
    },
    {
      "id": "R8",
      "text": "Alle verplichte requirements en fasebewijzen zijn inhoudelijk geldig vóór finish; ontbrekende/failed checks, mislukte push en onbevestigde remote readback blokkeren done. Regressies dekken de agent-brain push-fail/done-route en legacy finish-before-ship, ook via handmatige bypassroutes.",
      "source": "legacy_insights_planning",
      "status": "verified",
      "evidence": [
        {
          "created_at": "2026-09-13T16:42:48+02:00",
          "agent": "codex-astra-high",
          "summary": ".go/runs/abc-05/completion/verification-8d2d3adf7f1c4e418ca2bb745c7ab4bb.json"
        }
      ]
    }
  ],
  "models": {},
  "task_hash": "3c71c85a4ce46ffd4fe0f3476b51ea29fcb70a4464b7fdeeb45b07f73e010250",
  "code": {},
  "execution_cwd": "/Users/viggomeesters/Dev/go-workflow-stack",
  "controller": {
    "host": "macbook-pro-van-viggo-1.home",
    "pid": 21077
  },
  "worker_group": null,
  "inflight": null
}
