{
  "schema": "go-workflow.managed-run.v1",
  "task_id": "autonomy-07",
  "project": "go-workflow-stack",
  "control_repo": "/Users/viggomeesters/Dev/go-workflow-stack",
  "owner": "codex-astra-high",
  "run_id": "autonomy-07-20260922",
  "workspace": {
    "task_id": "autonomy-07",
    "owner": "codex-astra-high",
    "run_id": "autonomy-07-20260922",
    "control_repo": "/Users/viggomeesters/Dev/go-workflow-stack",
    "path": "/Users/viggomeesters/Documents/Codex/2026-09-22/autonomy/work/autonomy-07",
    "branch": "codex/autonomy-07",
    "base_branch": "main",
    "base_commit": "1d5eb181c54af998538a397d4ea9168e4a509e4c",
    "schema": "go-workflow.workspace-state.v1",
    "common_dir": "/Users/viggomeesters/Dev/go-workflow-stack/.git",
    "repository_id": "51c2a12a0f224916b1585e3dfe1bf86f",
    "generation": "e9a3595a60204e6399cf641093229829",
    "state": "ready"
  },
  "phase": "complete",
  "attempt": 1,
  "check_index": 0,
  "checks": [],
  "phase_evidence": [],
  "effects": {},
  "budgets": [],
  "history": [],
  "requirements": [
    {
      "id": "R1",
      "text": "Each independently shippable release-required task performs scoped commit/push, required tag/release/deployment and exact remote/live readback before done. Honor explicit no-release policies; do not invent targets, repeat a deployment or wait for unrelated research.",
      "source": "intake_acceptance",
      "status": "pending",
      "evidence": []
    },
    {
      "id": "R2",
      "text": "One release owner retains durable intent/reservation until verified readback or proven safe abort. Lost acknowledgements trigger observation before retry; unknown effects block the publication channel.",
      "source": "intake_acceptance",
      "status": "pending",
      "evidence": []
    },
    {
      "id": "R3",
      "text": "Preserve unrelated dirt, local saves, unregistered branches/worktrees and restricted local artifacts. Stage only owned changes, retain recoverable work, and verify cleanup/remote parity without force-reset, broad git add or force-push.",
      "source": "intake_acceptance",
      "status": "pending",
      "evidence": []
    },
    {
      "id": "R4",
      "text": "Distinguish product revisions from workflow/checkpoint commits; metadata-only closure must not redeploy. A remote/base advance requires controlled reconciliation and fresh applicable evidence, with conflict repair bounded by scope.",
      "source": "intake_acceptance",
      "status": "pending",
      "evidence": []
    },
    {
      "id": "R5",
      "text": "Expose exact remaining Git/release blockers to the campaign; a task completed locally but not delivered must never be reported live.",
      "source": "intake_acceptance",
      "status": "pending",
      "evidence": []
    },
    {
      "id": "R6",
      "text": "Complete this independently shippable stack change with content-bound checks/critic, scoped commit/push, immutable release and remote readback; preserve user dirt and historical evidence. Current request authorizes planning only; no execution or publication starts during intake.",
      "source": "intake_acceptance",
      "status": "pending",
      "evidence": []
    }
  ],
  "models": {},
  "task_hash": "d3c1f944f564a79117abe80c89a68b5856715d0f454e924712ae2c4590132038",
  "code": {},
  "execution_cwd": "/Users/viggomeesters/Dev/go-workflow-stack",
  "controller": {
    "host": "mac.home",
    "pid": 74577
  },
  "worker_group": null,
  "inflight": null
}
